{"$schema":"http://json-schema.org/draft-07/schema#","type":"object","required":["schema_version","edges","cycles","requirement_cycles","queue_cycles","orphan_projects","unowned_capabilities"],"properties":{"schema_version":{"const":1},"edges":{"type":"array","items":{"$ref":"dependency.schema.json"}},"cycles":{"type":"array","items":{"type":"array","items":{"type":"string"}}},"requirement_cycles":{"type":"array","items":{"type":"array","items":{"type":"string"}}},"queue_cycles":{"type":"array","items":{"type":"array","items":{"type":"string"}}},"orphan_projects":{"type":"array","items":{"type":"string"}},"unowned_capabilities":{"type":"array","items":{"type":"string"}}},"additionalProperties":false}
